{
  "$schema": "https://json-schema.org/draft/2020-12/schema",
  "$id": "https://example.local/schemas/initials.schema.json",
  "title": "Bible Initials Session Pack",
  "type": "object",
  "additionalProperties": false,
  "required": [
    "$schema",
    "game",
    "version",
    "displayName",
    "roundsPerSession",
    "sessions"
  ],
  "properties": {
    "$schema": {
      "type": "string"
    },
    "game": {
      "const": "initials"
    },
    "version": {
      "type": "integer",
      "minimum": 1
    },
    "displayName": {
      "type": "string",
      "minLength": 1
    },
    "roundsPerSession": {
      "type": "integer",
      "minimum": 1
    },
    "sessions": {
      "type": "array",
      "minItems": 1,
      "items": {
        "$ref": "#/$defs/session"
      }
    }
  },
  "$defs": {
    "session": {
      "type": "object",
      "additionalProperties": false,
      "required": [
        "id",
        "title",
        "theme",
        "rounds"
      ],
      "properties": {
        "id": {
          "type": "string",
          "pattern": "^[a-z0-9-]+$"
        },
        "title": {
          "type": "string",
          "minLength": 1
        },
        "theme": {
          "type": "string",
          "minLength": 1
        },
        "rounds": {
          "type": "array",
          "minItems": 1,
          "items": {
            "$ref": "#/$defs/round"
          }
        }
      }
    },
    "round": {
      "type": "object",
      "additionalProperties": false,
      "required": [
        "id",
        "category",
        "initials",
        "answer",
        "aliases",
        "hints",
        "difficulty",
        "teachingNote"
      ],
      "properties": {
        "id": {
          "type": "string",
          "pattern": "^[a-z0-9-]+$"
        },
        "category": {
          "type": "string",
          "minLength": 1
        },
        "initials": {
          "type": "string",
          "pattern": "^[A-Z]\\.[A-Z]\\.$"
        },
        "answer": {
          "type": "string",
          "minLength": 1
        },
        "aliases": {
          "type": "array",
          "minItems": 1,
          "uniqueItems": true,
          "items": {
            "type": "string",
            "minLength": 1
          }
        },
        "hints": {
          "type": "array",
          "minItems": 6,
          "maxItems": 20,
          "items": {
            "type": "string",
            "minLength": 1
          }
        },
        "difficulty": {
          "type": "string",
          "enum": [
            "easy",
            "medium",
            "hard"
          ]
        },
        "teachingNote": {
          "type": "string",
          "minLength": 1
        }
      }
    }
  }
}
