{
  "$schema": "./schemas/initials.schema.json",
  "game": "initials",
  "version": 1,
  "displayName": "Bible Initials",
  "roundsPerSession": 5,
  "sessions": [
    {
      "id": "in-session-01",
      "title": "Places And Objects",
      "theme": "Well-known locations and sacred items",
      "rounds": [
        {
          "id": "in-s1-r1",
          "category": "Object",
          "initials": "A.C.",
          "answer": "Ark of the Covenant",
          "aliases": [
            "Ark of the Covenant",
            "ark of the covenant",
            "covenant ark"
          ],
          "hints": [
            "This answer names a sacred object rather than a person or place.",
            "It belonged at the center of Israel's worship life.",
            "This item represented God's covenant presence among Israel.",
            "Priests handled it with great care during Israel's movements.",
            "It was carried with strict instructions and housed the tablets of the law.",
            "It sat in the Most Holy Place before the exile."
          ],
          "difficulty": "easy",
          "teachingNote": "Review Ark of the Covenant and how it connects to the Bible before continuing."
        },
        {
          "id": "in-s1-r2",
          "category": "Object",
          "initials": "B.B.",
          "answer": "Burning Bush",
          "aliases": [
            "Burning Bush",
            "burning bush"
          ],
          "hints": [
            "This answer describes a dramatic sign, not a permanent location.",
            "A future deliverer noticed it while working alone outdoors.",
            "This sign appeared while a shepherd was in the wilderness.",
            "It interrupted ordinary work with a holy encounter.",
            "Its mystery was not just flame, but the fact that it remained intact.",
            "God called Moses through this object near Horeb."
          ],
          "difficulty": "medium",
          "teachingNote": "Review Burning Bush and how it connects to the Bible before continuing."
        },
        {
          "id": "in-s1-r3",
          "category": "Place",
          "initials": "R.S.",
          "answer": "Red Sea",
          "aliases": [
            "Red Sea",
            "red sea"
          ],
          "hints": [
            "This answer names a body of water tied to Israel's escape story.",
            "It became the boundary between fear and deliverance.",
            "This place became the edge of a crisis after Israel left Egypt.",
            "God made a route through it when no route existed.",
            "A path appeared here where there should not have been one.",
            "Pharaoh's army was overwhelmed when the waters returned."
          ],
          "difficulty": "hard",
          "teachingNote": "Review Red Sea and how it connects to the Bible before continuing."
        },
        {
          "id": "in-s1-r4",
          "category": "Place",
          "initials": "J.R.",
          "answer": "Jordan River",
          "aliases": [
            "Jordan River",
            "jordan river",
            "river jordan"
          ],
          "hints": [
            "This answer names a river rather than a city or mountain.",
            "It is important in both Old and New Testament scenes.",
            "Crossings and baptisms both make this location significant.",
            "Its waters marked a transition into promise and ministry.",
            "Israel entered the promised land after this water stopped upstream.",
            "John baptized many people here, including Jesus."
          ],
          "difficulty": "easy",
          "teachingNote": "Review Jordan River and how it connects to the Bible before continuing."
        },
        {
          "id": "in-s1-r5",
          "category": "Place",
          "initials": "U.R.",
          "answer": "Upper Room",
          "aliases": [
            "Upper Room",
            "upper room"
          ],
          "hints": [
            "This answer is an indoor place connected with a small gathered group.",
            "It became important during a tense and prayerful season in Jerusalem.",
            "This indoor setting is tied to waiting, prayer, and shared meals.",
            "Followers of Jesus were told to gather and remain together here.",
            "Jesus ate with the disciples here before his arrest.",
            "Acts also connects this place with the believers gathered in Jerusalem."
          ],
          "difficulty": "medium",
          "teachingNote": "Review Upper Room and how it connects to the Bible before continuing."
        }
      ]
    },
    {
      "id": "in-session-02",
      "title": "People And Roles",
      "theme": "Recognizable names and titles",
      "rounds": [
        {
          "id": "in-s2-r1",
          "category": "Parable Character",
          "initials": "G.S.",
          "answer": "Good Samaritan",
          "aliases": [
            "Good Samaritan",
            "good samaritan"
          ],
          "hints": [
            "This answer is a parable figure, not a historical officeholder.",
            "He became memorable because compassion came from an unexpected source.",
            "This figure becomes memorable because compassion came from an unexpected direction.",
            "His actions mattered more than the religious status of those who passed by.",
            "Religious passersby failed where this traveler acted.",
            "Jesus used this character to redefine neighbor love."
          ],
          "difficulty": "hard",
          "teachingNote": "Review Good Samaritan and how it connects to the Bible before continuing."
        },
        {
          "id": "in-s2-r2",
          "category": "Prophet",
          "initials": "J.B.",
          "answer": "John the Baptist",
          "aliases": [
            "John the Baptist",
            "john the baptist",
            "john baptist"
          ],
          "hints": [
            "This answer names a preacher whose ministry prepared for someone greater.",
            "He lived and spoke in a rough wilderness setting.",
            "This desert preacher prepared the way for someone greater.",
            "His message centered on repentance and readiness.",
            "Crowds came to hear repentance and receive baptism from him.",
            "He baptized Jesus and later died under Herod's rule."
          ],
          "difficulty": "easy",
          "teachingNote": "Review John the Baptist and how it connects to the Bible before continuing."
        },
        {
          "id": "in-s2-r3",
          "category": "Queen",
          "initials": "Q.E.",
          "answer": "Queen Esther",
          "aliases": [
            "Queen Esther",
            "queen esther",
            "esther"
          ],
          "hints": [
            "This answer is a woman whose position gave her access in a dangerous court.",
            "Her story depends on courage, timing, and hidden identity.",
            "This woman navigated danger inside a Persian court.",
            "A threat against her people forced her to act.",
            "Her courage involved timing, banquets, and an unsummoned approach.",
            "She helped stop Haman's plot against the Jews."
          ],
          "difficulty": "medium",
          "teachingNote": "Review Queen Esther and how it connects to the Bible before continuing."
        },
        {
          "id": "in-s2-r4",
          "category": "King",
          "initials": "K.D.",
          "answer": "King David",
          "aliases": [
            "King David",
            "king david",
            "david"
          ],
          "hints": [
            "This answer is one of Israel's best-known rulers.",
            "His story begins long before he sat on a throne.",
            "This ruler first became known through music, courage, and a sling.",
            "He united kingship, worship language, and military leadership.",
            "Jerusalem became central during his reign.",
            "He is Israel's shepherd king and a major psalm writer."
          ],
          "difficulty": "hard",
          "teachingNote": "Review King David and how it connects to the Bible before continuing."
        },
        {
          "id": "in-s2-r5",
          "category": "Apostle",
          "initials": "A.P.",
          "answer": "Apostle Paul",
          "aliases": [
            "Apostle Paul",
            "apostle paul",
            "paul"
          ],
          "hints": [
            "This answer names a major New Testament missionary.",
            "His ministry followed a complete redirection of life.",
            "This missionary wrote many New Testament letters.",
            "He carried the gospel across cities in the Roman world.",
            "His ministry followed a dramatic conversion and years of travel.",
            "He was once known as Saul of Tarsus."
          ],
          "difficulty": "easy",
          "teachingNote": "Review Apostle Paul and how it connects to the Bible before continuing."
        }
      ]
    },
    {
      "id": "in-session-03",
      "title": "Events And Images",
      "theme": "Foundational scenes from across Scripture",
      "rounds": [
        {
          "id": "in-s3-r1",
          "category": "Law",
          "initials": "T.C.",
          "answer": "Ten Commandments",
          "aliases": [
            "Ten Commandments",
            "ten commandments"
          ],
          "hints": [
            "This answer is a group of commands rather than a person or place.",
            "It stands near the beginning of Israel's covenant life.",
            "These words define covenant boundaries for worship and community.",
            "They summarize loyalty to God and responsibility toward others.",
            "They were first given at Sinai and written on stone tablets.",